{
  "schema_version": 1,
  "authority": "README.md",
  "project_type": "software",
  "note": "Pilot self-reporting contract. Activity reporting, completion authority and the bounded three-pilot README synchroniser are implemented and verified. Authenticated private-dashboard delivery remains a separate future stage. No overall percentage is enabled because milestone weights have not been approved.",
  "stages": [
    {
      "id": "activity_dashboard",
      "label": "Activity ranking and public/private dashboard split",
      "completed": 1,
      "total": 1,
      "evidence": "README.md#three-outputs-one-engine"
    },
    {
      "id": "completion_authority_engine",
      "label": "Authority-backed completion calculation",
      "completed": 1,
      "total": 1,
      "evidence": "README.md#completion-authority"
    },
    {
      "id": "private_authenticated_delivery",
      "label": "Authenticated private dashboard delivery",
      "completed": 0,
      "total": 1,
      "evidence": "README.md#private-owner-dashboard"
    },
    {
      "id": "daily_readme_synchroniser",
      "label": "Daily authority-backed README synchroniser",
      "completed": 1,
      "total": 1,
      "evidence": "docs/README_SYNCHRONISER.md"
    }
  ],
  "overall": {
    "enabled": false
  }
}
