{
  "schema_version": 1,
  "authority": "docs/PROJECT_AUTHORITY.md",
  "project_type": "manuscript",
  "note": "Stage figures are evidence-backed. Overall completion is deliberately enabled with approved weights.",
  "stages": [
    {
      "id": "drafting",
      "label": "Drafting",
      "completed": 36,
      "total": 36,
      "weight": 25,
      "evidence": "docs/PROJECT_AUTHORITY.md#draft-authority"
    },
    {
      "id": "structural_editing",
      "label": "Structural editing",
      "completed": 30,
      "total": 36,
      "weight": 30,
      "evidence": "docs/PROJECT_AUTHORITY.md#structural-editing"
    },
    {
      "id": "line_editing",
      "label": "Line editing",
      "completed": 0,
      "total": 36,
      "weight": 20
    },
    {
      "id": "copyediting",
      "label": "Copy-editing",
      "completed": 0,
      "total": 36,
      "weight": 15
    },
    {
      "id": "print_preflight",
      "label": "Print preflight",
      "completed": 0,
      "total": 1,
      "weight": 10
    }
  ],
  "overall": {
    "enabled": true
  }
}
